source,title,journal,year,authors,doi,link
CrossRef,Impact of the Urology Assessment Unit on the Emergency Urology Patient Pathway,Cureus,2025,"Hasan A Al-Ibraheem, Nadine McCauley, Mudassir Wani, Jim Wilson",10.7759/cureus.94293,https://doi.org/10.7759/cureus.94293
CrossRef,"MINIATURIZAÇÃO DAS TÉCNICAS ENDOUROLÓGICAS NO MANEJO DA LITÍASE URINÁRIA: AVANÇOS, SEGURANÇA E CONSOLIDAÇÃO DE UM NOVO PARADIGMA NA UROLOGIA MODERNA","Revista Ibero-Americana de Humanidades, Ciências e Educação",2025,"Luiz Gabriel Campos Lobo, Aline Trovâo  Queiroz",10.51891/rease.v11i10.21369,https://doi.org/10.51891/rease.v11i10.21369
CrossRef,KI og effektivisering: Hvordan GPT-4 fant 155.000 overflødige årsverk i norsk offentlig sektor,Stat &amp; Styring,2025,"Ståle Grut, Alexander Moltubakk Kempton, Hilde Reinertsen",10.18261/stat.35.3.1,https://doi.org/10.18261/stat.35.3.1
CrossRef,Is Consent-GPT valid? Public attitudes to generative AI use in surgical consent,AI &amp; SOCIETY,2025,"Jemima Winifred Allen, Ivar Rodríguez Hannikainen, Julian Savulescu, Dominic Wilkinson, Brian David Earp",10.1007/s00146-025-02644-9,https://doi.org/10.1007/s00146-025-02644-9
CrossRef,Celebrating 30 years of promoting and advancing urology nursing,British Journal of Nursing,2025,Sarah Hillery,10.12968/bjon.2025.0459,https://doi.org/10.12968/bjon.2025.0459
CrossRef,"Self-Urinary Catheter Removal for Urology Day Cases: A Safe, Efficient, Sustainable, and Patient-Centred Approach",Cureus,2025,"Enamur Rahman, Branimir Penev, Irtiza Bhatti, Kirsty Ellis, Muhammad Usman Javed, Annie Murphy, Alastair Henderson, Mark Cynk",10.7759/cureus.94256,https://doi.org/10.7759/cureus.94256
CrossRef,Feature-centric mobile applications clustering using GPT-3 enabled context enrichment,Cluster Computing,2025,"Sana Saeed, Kashif Bilal, Junaid Shuja, Abdallah Namoun, Isa Ali Ibrahim",10.1007/s10586-024-05082-2,https://doi.org/10.1007/s10586-024-05082-2
CrossRef,Analisis Pengaruh Chat GPT dalam Meningkatkan Keterlibatan Mahasiswa dalam Blended Learning,Innovation and Applied Education Journal,2025,"Ade Alfian, Dedi Risaldi2, Annajmi Rauf",10.61220/iaej.v2i3.252,https://doi.org/10.61220/iaej.v2i3.252
CrossRef,GPT-4 shows comparable performance to human examiners in ranking open-text answers,Scientific Reports,2025,"Abdullah Al Zubaer, Michael Granitzer, Stephan Geschwind, Johann Graf Lambsdorff, Deborah Voss",10.1038/s41598-025-21572-8,https://doi.org/10.1038/s41598-025-21572-8
CrossRef,ViSketch-GPT: Collaborative Multi-scale Feature Extraction For Hand-Drawn Sketch Retrieval,Lecture Notes in Computer Science,2026,"Giulio Federico, Fabio Carrara, Claudio Gennaro, Marco Di Benedetto",10.1007/978-3-032-06069-3_1,https://doi.org/10.1007/978-3-032-06069-3_1
CrossRef,Estrategias para la honestidad académica y Chat GPT,Reincisol.,2025,"Valeria Estefanía Vera Astudillo, Jenniffer Karem Acosta Santillan",10.59282/reincisol.v4(8)3873-3895,https://doi.org/10.59282/reincisol.v4(8)3873-3895
CrossRef,The Impact of Chat GPT on the Self-learning of Undergraduate Students,VNU Journal of Science: Education Research,2025,"Dang Thi Thanh Thuy, Nguyen Thanh Tam, Le Thi Kieu Chinh, Nguyen Thi Hai Yen, Bui Thi Ha Giang",10.25073/2588-1159/vnuer.5323,https://doi.org/10.25073/2588-1159/vnuer.5323
CrossRef,Invisible Bias in GPT-4o-mini: Detecting Disparities in AI-Generated Patient Messaging,Journal of Medical Systems,2025,"Christopher Reagen, Katelyn M. Brown, Thomas Hocker",10.1007/s10916-025-02276-y,https://doi.org/10.1007/s10916-025-02276-y
